"No.","Time","Source","Destination","Protocol","Length","Info"
"1","0.000000000","10.0.2.15","192.168.1.170","TCP","74","40678  >  3000 [SYN] Seq=0 Win=64240 Len=0 MSS=1460 SACK_PERM=1 TSval=3906940097 TSecr=0 WS=128"
"2","0.001017140","192.168.1.170","10.0.2.15","TCP","60","3000  >  40678 [SYN, ACK] Seq=0 Ack=1 Win=65535 Len=0 MSS=1460"
"3","0.001060546","10.0.2.15","192.168.1.170","TCP","54","40678  >  3000 [ACK] Seq=1 Ack=1 Win=64240 Len=0"
"4","0.001247988","10.0.2.15","192.168.1.170","HTTP","193","GET /options HTTP/1.1 "
"5","0.001764397","192.168.1.170","10.0.2.15","TCP","60","3000  >  40678 [ACK] Seq=1 Ack=140 Win=65535 Len=0"
"6","0.016250110","192.168.1.170","10.0.2.15","TCP","1514","3000  >  40678 [PSH, ACK] Seq=1 Ack=140 Win=65535 Len=1460 [TCP segment of a reassembled PDU]"
"7","0.016278229","10.0.2.15","192.168.1.170","TCP","54","40678  >  3000 [ACK] Seq=140 Ack=1461 Win=63900 Len=0"
"8","0.016425281","192.168.1.170","10.0.2.15","TCP","1474","3000  >  40678 [ACK] Seq=1461 Ack=140 Win=65535 Len=1420 [TCP segment of a reassembled PDU]"
"9","0.016446681","10.0.2.15","192.168.1.170","TCP","54","40678  >  3000 [ACK] Seq=140 Ack=2881 Win=62480 Len=0"
"10","0.016738701","192.168.1.170","10.0.2.15","TCP","5734","3000  >  40678 [ACK] Seq=2881 Ack=140 Win=65535 Len=5680 [TCP segment of a reassembled PDU]"
"11","0.016752108","10.0.2.15","192.168.1.170","TCP","54","40678  >  3000 [ACK] Seq=140 Ack=8561 Win=61060 Len=0"
"12","0.016980476","192.168.1.170","10.0.2.15","TCP","7154","3000  >  40678 [ACK] Seq=8561 Ack=140 Win=65535 Len=7100 [TCP segment of a reassembled PDU]"
"13","0.016993675","10.0.2.15","192.168.1.170","TCP","54","40678  >  3000 [ACK] Seq=140 Ack=15661 Win=55380 Len=0"
"14","0.017203327","192.168.1.170","10.0.2.15","HTTP","1846","HTTP/1.1 200 OK  (application/json)"
"15","0.017216356","10.0.2.15","192.168.1.170","TCP","54","40678  >  3000 [ACK] Seq=140 Ack=17453 Win=62480 Len=0"
"16","0.019927652","10.0.2.15","192.168.1.170","TCP","54","40678  >  3000 [FIN, ACK] Seq=140 Ack=17453 Win=63900 Len=0"
"17","0.020218680","192.168.1.170","10.0.2.15","TCP","60","3000  >  40678 [ACK] Seq=17453 Ack=141 Win=65535 Len=0"
"18","0.033365137","192.168.1.170","10.0.2.15","TCP","60","3000  >  40678 [FIN, ACK] Seq=17453 Ack=141 Win=65535 Len=0"
"19","0.033384164","10.0.2.15","192.168.1.170","TCP","54","40678  >  3000 [ACK] Seq=141 Ack=17454 Win=63900 Len=0"
"20","0.247738165","10.0.2.15","192.168.1.170","TCP","74","40706  >  3000 [SYN] Seq=0 Win=64240 Len=0 MSS=1460 SACK_PERM=1 TSval=3906940345 TSecr=0 WS=128"
"21","0.248015508","10.0.2.15","192.168.1.171","TCP","74","57982  >  3000 [SYN] Seq=0 Win=64240 Len=0 MSS=1460 SACK_PERM=1 TSval=1080590465 TSecr=0 WS=128"
"22","0.248492183","192.168.1.170","10.0.2.15","TCP","60","3000  >  40706 [SYN, ACK] Seq=0 Ack=1 Win=65535 Len=0 MSS=1460"
"23","0.248515868","10.0.2.15","192.168.1.170","TCP","54","40706  >  3000 [ACK] Seq=1 Ack=1 Win=64240 Len=0"
"24","0.248553136","192.168.1.171","10.0.2.15","TCP","60","3000  >  57982 [SYN, ACK] Seq=0 Ack=1 Win=65535 Len=0 MSS=1460"
"25","0.248563127","10.0.2.15","192.168.1.171","TCP","54","57982  >  3000 [ACK] Seq=1 Ack=1 Win=64240 Len=0"
"26","0.248738275","10.0.2.15","192.168.1.170","HTTP","190","GET /info HTTP/1.1 "
"27","0.248916869","10.0.2.15","192.168.1.171","HTTP","190","GET /info HTTP/1.1 "
"28","0.248972173","192.168.1.170","10.0.2.15","TCP","60","3000  >  40706 [ACK] Seq=1 Ack=137 Win=65535 Len=0"
"29","0.249169796","192.168.1.171","10.0.2.15","TCP","60","3000  >  57982 [ACK] Seq=1 Ack=137 Win=65535 Len=0"
"30","0.266416249","192.168.1.171","10.0.2.15","HTTP","444","HTTP/1.1 200 OK  (application/json)"
"31","0.266436197","10.0.2.15","192.168.1.171","TCP","54","57982  >  3000 [ACK] Seq=137 Ack=391 Win=63850 Len=0"
"32","0.267428569","10.0.2.15","192.168.1.171","TCP","54","57982  >  3000 [FIN, ACK] Seq=137 Ack=391 Win=63850 Len=0"
"33","0.267708379","192.168.1.171","10.0.2.15","TCP","60","3000  >  57982 [ACK] Seq=391 Ack=138 Win=65535 Len=0"
"34","0.273071757","192.168.1.170","10.0.2.15","HTTP","444","HTTP/1.1 200 OK  (application/json)"
"35","0.273102791","10.0.2.15","192.168.1.170","TCP","54","40706  >  3000 [ACK] Seq=137 Ack=391 Win=63850 Len=0"
"36","0.277306132","10.0.2.15","192.168.1.171","TCP","74","57984  >  3000 [SYN] Seq=0 Win=64240 Len=0 MSS=1460 SACK_PERM=1 TSval=1080590494 TSecr=0 WS=128"
"37","0.277844761","10.0.2.15","192.168.1.170","TCP","54","40706  >  3000 [FIN, ACK] Seq=137 Ack=391 Win=63850 Len=0"
"38","0.278762809","192.168.1.170","10.0.2.15","TCP","60","3000  >  40706 [ACK] Seq=391 Ack=138 Win=65535 Len=0"
"39","0.278818061","192.168.1.171","10.0.2.15","TCP","60","3000  >  57984 [SYN, ACK] Seq=0 Ack=1 Win=65535 Len=0 MSS=1460"
"40","0.278867702","10.0.2.15","192.168.1.171","TCP","54","57984  >  3000 [ACK] Seq=1 Ack=1 Win=64240 Len=0"
"41","0.279146015","10.0.2.15","192.168.1.171","HTTP","193","GET /options HTTP/1.1 "
"42","0.280555072","192.168.1.171","10.0.2.15","TCP","60","3000  >  57984 [ACK] Seq=1 Ack=140 Win=65535 Len=0"
"43","0.281140125","192.168.1.171","10.0.2.15","TCP","60","3000  >  57982 [FIN, ACK] Seq=391 Ack=138 Win=65535 Len=0"
"44","0.281165087","10.0.2.15","192.168.1.171","TCP","54","57982  >  3000 [ACK] Seq=138 Ack=392 Win=63850 Len=0"
"45","0.281573569","192.168.1.170","10.0.2.15","TCP","60","3000  >  40706 [FIN, ACK] Seq=391 Ack=138 Win=65535 Len=0"
"46","0.281587764","10.0.2.15","192.168.1.170","TCP","54","40706  >  3000 [ACK] Seq=138 Ack=392 Win=63850 Len=0"
"47","0.285674606","192.168.1.171","10.0.2.15","TCP","2894","3000  >  57984 [ACK] Seq=1 Ack=140 Win=65535 Len=2840 [TCP segment of a reassembled PDU]"
"48","0.285694238","10.0.2.15","192.168.1.171","TCP","54","57984  >  3000 [ACK] Seq=140 Ack=2841 Win=62480 Len=0"
"49","0.285814645","192.168.1.171","10.0.2.15","TCP","4314","3000  >  57984 [ACK] Seq=2841 Ack=140 Win=65535 Len=4260 [TCP segment of a reassembled PDU]"
"50","0.285822422","10.0.2.15","192.168.1.171","TCP","54","57984  >  3000 [ACK] Seq=140 Ack=7101 Win=59640 Len=0"
"51","0.285935102","192.168.1.171","10.0.2.15","TCP","5734","3000  >  57984 [ACK] Seq=7101 Ack=140 Win=65535 Len=5680 [TCP segment of a reassembled PDU]"
"52","0.285941752","10.0.2.15","192.168.1.171","TCP","54","57984  >  3000 [ACK] Seq=140 Ack=12781 Win=61060 Len=0"
"53","0.288549543","192.168.1.171","10.0.2.15","HTTP","4726","HTTP/1.1 200 OK  (application/json)"
"54","0.288572437","10.0.2.15","192.168.1.171","TCP","54","57984  >  3000 [ACK] Seq=140 Ack=17453 Win=61060 Len=0"
"55","0.296536078","10.0.2.15","192.168.1.171","TCP","74","57988  >  3000 [SYN] Seq=0 Win=64240 Len=0 MSS=1460 SACK_PERM=1 TSval=1080590514 TSecr=0 WS=128"
"56","0.296747782","10.0.2.15","192.168.1.171","TCP","54","57984  >  3000 [FIN, ACK] Seq=140 Ack=17453 Win=63900 Len=0"
"57","0.296957885","192.168.1.171","10.0.2.15","TCP","60","3000  >  57984 [ACK] Seq=17453 Ack=141 Win=65535 Len=0"
"58","0.297290964","192.168.1.171","10.0.2.15","TCP","60","3000  >  57988 [SYN, ACK] Seq=0 Ack=1 Win=65535 Len=0 MSS=1460"
"59","0.297303269","10.0.2.15","192.168.1.171","TCP","54","57988  >  3000 [ACK] Seq=1 Ack=1 Win=64240 Len=0"
"60","0.297701824","10.0.2.15","192.168.1.171","TCP","319","57988  >  3000 [PSH, ACK] Seq=1 Ack=1 Win=64240 Len=265 [TCP segment of a reassembled PDU]"
"61","0.297791859","10.0.2.15","192.168.1.171","HTTP","907","POST /task/new/init?token= HTTP/1.1 "
"62","0.297999917","192.168.1.171","10.0.2.15","TCP","60","3000  >  57988 [ACK] Seq=1 Ack=266 Win=65535 Len=0"
"63","0.298158087","192.168.1.171","10.0.2.15","TCP","60","3000  >  57988 [ACK] Seq=1 Ack=1119 Win=65535 Len=0"
"64","0.300289410","192.168.1.171","10.0.2.15","TCP","60","3000  >  57984 [FIN, ACK] Seq=17453 Ack=141 Win=65535 Len=0"
"65","0.300309715","10.0.2.15","192.168.1.171","TCP","54","57984  >  3000 [ACK] Seq=141 Ack=17454 Win=63900 Len=0"
"66","0.338742947","192.168.1.171","10.0.2.15","HTTP","313","HTTP/1.1 200 OK  (application/json)"
"67","0.338764846","10.0.2.15","192.168.1.171","TCP","54","57988  >  3000 [ACK] Seq=1119 Ack=260 Win=63981 Len=0"
"68","0.339937093","10.0.2.15","192.168.1.170","TCP","74","40722  >  3000 [SYN] Seq=0 Win=64240 Len=0 MSS=1460 SACK_PERM=1 TSval=3906940437 TSecr=0 WS=128"
"69","0.340801600","192.168.1.170","10.0.2.15","TCP","60","3000  >  40722 [SYN, ACK] Seq=0 Ack=1 Win=65535 Len=0 MSS=1460"
"70","0.340833897","10.0.2.15","192.168.1.170","TCP","54","40722  >  3000 [ACK] Seq=1 Ack=1 Win=64240 Len=0"
"71","0.352200258","10.0.2.15","192.168.1.171","TCP","312","57988  >  3000 [PSH, ACK] Seq=1119 Ack=260 Win=63981 Len=258 [TCP segment of a reassembled PDU]"
"72","0.352403973","10.0.2.15","192.168.1.171","TCP","7354","57988  >  3000 [ACK] Seq=1377 Ack=260 Win=63981 Len=7300 [TCP segment of a reassembled PDU]"
"73","0.352431087","10.0.2.15","192.168.1.171","TCP","5894","57988  >  3000 [ACK] Seq=8677 Ack=260 Win=63981 Len=5840 [TCP segment of a reassembled PDU]"
"74","0.352525799","192.168.1.171","10.0.2.15","TCP","60","3000  >  57988 [ACK] Seq=260 Ack=1377 Win=65535 Len=0"
"75","0.352573368","10.0.2.15","192.168.1.171","TCP","2974","57988  >  3000 [ACK] Seq=14517 Ack=260 Win=63981 Len=2920 [TCP segment of a reassembled PDU]"
"76","0.352704110","10.0.2.15","192.168.1.171","TCP","74","57998  >  3000 [SYN] Seq=0 Win=64240 Len=0 MSS=1460 SACK_PERM=1 TSval=1080590570 TSecr=0 WS=128"
"77","0.352768380","192.168.1.171","10.0.2.15","TCP","60","3000  >  57988 [ACK] Seq=260 Ack=2837 Win=65535 Len=0"
"78","0.352774839","192.168.1.171","10.0.2.15","TCP","60","3000  >  57988 [ACK] Seq=260 Ack=4297 Win=65535 Len=0"
"79","0.352776843","192.168.1.171","10.0.2.15","TCP","60","3000  >  57988 [ACK] Seq=260 Ack=5757 Win=65535 Len=0"
"80","0.352780277","10.0.2.15","192.168.1.171","TCP","8814","57988  >  3000 [ACK] Seq=17437 Ack=260 Win=63981 Len=8760 [TCP segment of a reassembled PDU]"
"81","0.352801102","192.168.1.171","10.0.2.15","TCP","60","3000  >  57988 [ACK] Seq=260 Ack=7217 Win=65535 Len=0"
"82","0.352804730","192.168.1.171","10.0.2.15","TCP","60","3000  >  57988 [ACK] Seq=260 Ack=8677 Win=65535 Len=0"
"83","0.352806633","192.168.1.171","10.0.2.15","TCP","60","3000  >  57988 [ACK] Seq=260 Ack=10137 Win=65535 Len=0"
"84","0.352881041","192.168.1.171","10.0.2.15","TCP","60","3000  >  57988 [ACK] Seq=260 Ack=11597 Win=65535 Len=0"
"85","0.352886494","10.0.2.15","192.168.1.171","TCP","8814","57988  >  3000 [ACK] Seq=26197 Ack=260 Win=63981 Len=8760 [TCP segment of a reassembled PDU]"
"86","0.352894407","192.168.1.171","10.0.2.15","TCP","60","3000  >  57988 [ACK] Seq=260 Ack=13057 Win=65535 Len=0"
"87","0.352992879","192.168.1.171","10.0.2.15","TCP","60","3000  >  57988 [ACK] Seq=260 Ack=14517 Win=65535 Len=0"
"88","0.353000032","192.168.1.171","10.0.2.15","TCP","60","3000  >  57988 [ACK] Seq=260 Ack=15977 Win=65535 Len=0"
"89","0.353003218","192.168.1.171","10.0.2.15","TCP","60","3000  >  57988 [ACK] Seq=260 Ack=17437 Win=65535 Len=0"
"90","0.353008176","10.0.2.15","192.168.1.171","TCP","5894","57988  >  3000 [ACK] Seq=34957 Ack=260 Win=63981 Len=5840 [TCP segment of a reassembled PDU]"
"91","0.353182651","10.0.2.15","192.168.1.171","TCP","74","58000  >  3000 [SYN] Seq=0 Win=64240 Len=0 MSS=1460 SACK_PERM=1 TSval=1080590570 TSecr=0 WS=128"
"92","0.353311273","192.168.1.171","10.0.2.15","TCP","60","3000  >  57988 [ACK] Seq=260 Ack=18897 Win=65535 Len=0"
"93","0.353335367","192.168.1.171","10.0.2.15","TCP","60","3000  >  57988 [ACK] Seq=260 Ack=20357 Win=65535 Len=0"
"94","0.353340300","192.168.1.171","10.0.2.15","TCP","60","3000  >  57988 [ACK] Seq=260 Ack=21817 Win=65535 Len=0"
"95","0.353427052","192.168.1.171","10.0.2.15","TCP","60","3000  >  57988 [ACK] Seq=260 Ack=23277 Win=65535 Len=0"
"96","0.353433601","192.168.1.171","10.0.2.15","TCP","60","3000  >  57988 [ACK] Seq=260 Ack=24737 Win=65535 Len=0"
"97","0.353436007","192.168.1.171","10.0.2.15","TCP","60","3000  >  57988 [ACK] Seq=260 Ack=26197 Win=65535 Len=0"
"98","0.353440083","10.0.2.15","192.168.1.171","TCP","8814","57988  >  3000 [PSH, ACK] Seq=40797 Ack=260 Win=63981 Len=8760 [TCP segment of a reassembled PDU]"
"99","0.353466950","192.168.1.171","10.0.2.15","TCP","60","3000  >  57988 [ACK] Seq=260 Ack=27657 Win=65535 Len=0"
"100","0.353538354","192.168.1.171","10.0.2.15","TCP","60","3000  >  57988 [ACK] Seq=260 Ack=29117 Win=65535 Len=0"
"101","0.353544100","192.168.1.171","10.0.2.15","TCP","60","3000  >  57988 [ACK] Seq=260 Ack=30577 Win=65535 Len=0"
"102","0.353545691","192.168.1.171","10.0.2.15","TCP","60","3000  >  57988 [ACK] Seq=260 Ack=32037 Win=65535 Len=0"
"103","0.353624550","192.168.1.171","10.0.2.15","TCP","60","3000  >  57988 [ACK] Seq=260 Ack=33497 Win=65535 Len=0"
"104","0.353634376","192.168.1.171","10.0.2.15","TCP","60","3000  >  57988 [ACK] Seq=260 Ack=34957 Win=65535 Len=0"
"105","0.353641220","10.0.2.15","192.168.1.171","TCP","8814","57988  >  3000 [ACK] Seq=49557 Ack=260 Win=63981 Len=8760 [TCP segment of a reassembled PDU]"
"106","0.353671105","192.168.1.171","10.0.2.15","TCP","60","3000  >  57988 [ACK] Seq=260 Ack=36417 Win=65535 Len=0"
"107","0.353678877","192.168.1.171","10.0.2.15","TCP","60","3000  >  57988 [ACK] Seq=260 Ack=37877 Win=65535 Len=0"
"108","0.353753680","192.168.1.171","10.0.2.15","TCP","60","3000  >  57988 [ACK] Seq=260 Ack=39337 Win=65535 Len=0"
"109","0.353759138","192.168.1.171","10.0.2.15","TCP","60","3000  >  57988 [ACK] Seq=260 Ack=40797 Win=65535 Len=0"
"110","0.353763033","10.0.2.15","192.168.1.171","TCP","7354","57988  >  3000 [ACK] Seq=58317 Ack=260 Win=63981 Len=7300 [TCP segment of a reassembled PDU]"
"111","0.353885764","10.0.2.15","192.168.1.171","TCP","74","58002  >  3000 [SYN] Seq=0 Win=64240 Len=0 MSS=1460 SACK_PERM=1 TSval=1080590571 TSecr=0 WS=128"
"112","0.353967921","192.168.1.171","10.0.2.15","TCP","60","3000  >  57988 [ACK] Seq=260 Ack=42257 Win=65535 Len=0"
"113","0.353977855","10.0.2.15","192.168.1.171","TCP","1350","57988  >  3000 [PSH, ACK] Seq=65617 Ack=260 Win=63981 Len=1296 [TCP segment of a reassembled PDU]"
"114","0.354010162","192.168.1.171","10.0.2.15","TCP","60","3000  >  57988 [ACK] Seq=260 Ack=43717 Win=65535 Len=0"
"115","0.354015296","192.168.1.171","10.0.2.15","TCP","60","3000  >  57988 [ACK] Seq=260 Ack=45177 Win=65535 Len=0"
"116","0.354016673","192.168.1.171","10.0.2.15","TCP","60","3000  >  57988 [ACK] Seq=260 Ack=46637 Win=65535 Len=0"
"117","0.354083978","192.168.1.171","10.0.2.15","TCP","60","3000  >  57988 [ACK] Seq=260 Ack=48097 Win=65535 Len=0"
"118","0.354087912","192.168.1.171","10.0.2.15","TCP","60","3000  >  57988 [ACK] Seq=260 Ack=49557 Win=65535 Len=0"
"119","0.354089723","192.168.1.171","10.0.2.15","TCP","60","3000  >  57988 [ACK] Seq=260 Ack=51017 Win=65535 Len=0"
"120","0.354160143","192.168.1.171","10.0.2.15","TCP","60","3000  >  57988 [ACK] Seq=260 Ack=52477 Win=65535 Len=0"
"121","0.354164074","192.168.1.171","10.0.2.15","TCP","60","3000  >  57988 [ACK] Seq=260 Ack=53937 Win=65535 Len=0"
"122","0.354229133","192.168.1.171","10.0.2.15","TCP","60","3000  >  57988 [ACK] Seq=260 Ack=55397 Win=65535 Len=0"
"123","0.354232960","192.168.1.171","10.0.2.15","TCP","60","3000  >  57988 [ACK] Seq=260 Ack=56857 Win=65535 Len=0"
"124","0.354321844","192.168.1.171","10.0.2.15","TCP","60","3000  >  57988 [ACK] Seq=260 Ack=58317 Win=65535 Len=0"
"125","0.354329548","192.168.1.171","10.0.2.15","TCP","60","3000  >  57988 [ACK] Seq=260 Ack=59777 Win=65535 Len=0"
"126","0.354331980","192.168.1.171","10.0.2.15","TCP","60","3000  >  57988 [ACK] Seq=260 Ack=61237 Win=65535 Len=0"
"127","0.354333889","192.168.1.171","10.0.2.15","TCP","60","3000  >  57988 [ACK] Seq=260 Ack=62697 Win=65535 Len=0"
"128","0.354397918","192.168.1.171","10.0.2.15","TCP","60","3000  >  57988 [ACK] Seq=260 Ack=64157 Win=65535 Len=0"
"129","0.354493147","192.168.1.171","10.0.2.15","TCP","60","3000  >  57988 [ACK] Seq=260 Ack=65617 Win=65535 Len=0"
"130","0.354600468","10.0.2.15","192.168.1.171","TCP","74","58004  >  3000 [SYN] Seq=0 Win=64240 Len=0 MSS=1460 SACK_PERM=1 TSval=1080590572 TSecr=0 WS=128"
"131","0.354712280","192.168.1.171","10.0.2.15","TCP","60","3000  >  57988 [ACK] Seq=260 Ack=66913 Win=65535 Len=0"
"132","0.354823049","10.0.2.15","192.168.1.171","TCP","74","58006  >  3000 [SYN] Seq=0 Win=64240 Len=0 MSS=1460 SACK_PERM=1 TSval=1080590572 TSecr=0 WS=128"
"133","0.354920000","192.168.1.171","10.0.2.15","TCP","60","3000  >  58002 [SYN, ACK] Seq=0 Ack=1 Win=65535 Len=0 MSS=1460"
"134","0.354933193","10.0.2.15","192.168.1.171","TCP","54","58002  >  3000 [ACK] Seq=1 Ack=1 Win=64240 Len=0"
"135","0.354968283","192.168.1.171","10.0.2.15","TCP","60","3000  >  58000 [SYN, ACK] Seq=0 Ack=1 Win=65535 Len=0 MSS=1460"
"136","0.354977051","10.0.2.15","192.168.1.171","TCP","54","58000  >  3000 [ACK] Seq=1 Ack=1 Win=64240 Len=0"
"137","0.355009003","192.168.1.171","10.0.2.15","TCP","60","3000  >  57998 [SYN, ACK] Seq=0 Ack=1 Win=65535 Len=0 MSS=1460"
"138","0.355017852","10.0.2.15","192.168.1.171","TCP","54","57998  >  3000 [ACK] Seq=1 Ack=1 Win=64240 Len=0"
"139","0.355160324","10.0.2.15","192.168.1.171","TCP","74","58008  >  3000 [SYN] Seq=0 Win=64240 Len=0 MSS=1460 SACK_PERM=1 TSval=1080590572 TSecr=0 WS=128"
"140","0.355231406","192.168.1.171","10.0.2.15","TCP","60","3000  >  58004 [SYN, ACK] Seq=0 Ack=1 Win=65535 Len=0 MSS=1460"
"141","0.355239495","10.0.2.15","192.168.1.171","TCP","54","58004  >  3000 [ACK] Seq=1 Ack=1 Win=64240 Len=0"
"142","0.355388390","10.0.2.15","192.168.1.171","TCP","74","58010  >  3000 [SYN] Seq=0 Win=64240 Len=0 MSS=1460 SACK_PERM=1 TSval=1080590573 TSecr=0 WS=128"
"143","0.355535687","10.0.2.15","192.168.1.171","TCP","74","58012  >  3000 [SYN] Seq=0 Win=64240 Len=0 MSS=1460 SACK_PERM=1 TSval=1080590573 TSecr=0 WS=128"
"144","0.355600567","192.168.1.171","10.0.2.15","TCP","60","3000  >  58006 [SYN, ACK] Seq=0 Ack=1 Win=65535 Len=0 MSS=1460"
"145","0.355615287","10.0.2.15","192.168.1.171","TCP","54","58006  >  3000 [ACK] Seq=1 Ack=1 Win=64240 Len=0"
"146","0.355735705","10.0.2.15","192.168.1.171","TCP","74","58014  >  3000 [SYN] Seq=0 Win=64240 Len=0 MSS=1460 SACK_PERM=1 TSval=1080590573 TSecr=0 WS=128"
"147","0.355883326","10.0.2.15","192.168.1.171","TCP","74","58016  >  3000 [SYN] Seq=0 Win=64240 Len=0 MSS=1460 SACK_PERM=1 TSval=1080590573 TSecr=0 WS=128"
"148","0.356048815","10.0.2.15","192.168.1.171","TCP","74","58018  >  3000 [SYN] Seq=0 Win=64240 Len=0 MSS=1460 SACK_PERM=1 TSval=1080590573 TSecr=0 WS=128"
"149","0.356311831","192.168.1.171","10.0.2.15","TCP","60","3000  >  58014 [SYN, ACK] Seq=0 Ack=1 Win=65535 Len=0 MSS=1460"
"150","0.356326870","10.0.2.15","192.168.1.171","TCP","54","58014  >  3000 [ACK] Seq=1 Ack=1 Win=64240 Len=0"
"151","0.356357774","192.168.1.171","10.0.2.15","TCP","60","3000  >  58012 [SYN, ACK] Seq=0 Ack=1 Win=65535 Len=0 MSS=1460"
"152","0.356365654","10.0.2.15","192.168.1.171","TCP","54","58012  >  3000 [ACK] Seq=1 Ack=1 Win=64240 Len=0"
"153","0.356389958","192.168.1.171","10.0.2.15","TCP","60","3000  >  58010 [SYN, ACK] Seq=0 Ack=1 Win=65535 Len=0 MSS=1460"
"154","0.356395928","10.0.2.15","192.168.1.171","TCP","54","58010  >  3000 [ACK] Seq=1 Ack=1 Win=64240 Len=0"
"155","0.356417440","192.168.1.171","10.0.2.15","TCP","60","3000  >  58008 [SYN, ACK] Seq=0 Ack=1 Win=65535 Len=0 MSS=1460"
"156","0.356423406","10.0.2.15","192.168.1.171","TCP","54","58008  >  3000 [ACK] Seq=1 Ack=1 Win=64240 Len=0"
"157","0.356445618","192.168.1.171","10.0.2.15","TCP","60","3000  >  58018 [SYN, ACK] Seq=0 Ack=1 Win=65535 Len=0 MSS=1460"
"158","0.356451320","10.0.2.15","192.168.1.171","TCP","54","58018  >  3000 [ACK] Seq=1 Ack=1 Win=64240 Len=0"
"159","0.356502619","192.168.1.171","10.0.2.15","TCP","60","3000  >  58016 [SYN, ACK] Seq=0 Ack=1 Win=65535 Len=0 MSS=1460"
"160","0.356509469","10.0.2.15","192.168.1.171","TCP","54","58016  >  3000 [ACK] Seq=1 Ack=1 Win=64240 Len=0"
"161","0.356610214","10.0.2.15","192.168.1.170","HTTP","193","GET /options HTTP/1.1 "
"162","0.356765853","10.0.2.15","192.168.1.171","HTTP","8085","POST /task/new/upload/c059f23f-da81-4677-88c0-f36edeb5ecbd?token= HTTP/1.1  (JPEG JFIF image)"
"163","0.356901258","192.168.1.170","10.0.2.15","TCP","60","3000  >  40722 [ACK] Seq=1 Ack=140 Win=65535 Len=0"
"164","0.356907972","192.168.1.171","10.0.2.15","TCP","60","3000  >  57988 [ACK] Seq=260 Ack=68373 Win=65535 Len=0"
"165","0.356910887","192.168.1.171","10.0.2.15","TCP","60","3000  >  57988 [ACK] Seq=260 Ack=69833 Win=65535 Len=0"
"166","0.357000583","192.168.1.171","10.0.2.15","TCP","60","3000  >  57988 [ACK] Seq=260 Ack=71293 Win=65535 Len=0"
"167","0.357006559","192.168.1.171","10.0.2.15","TCP","60","3000  >  57988 [ACK] Seq=260 Ack=72753 Win=65535 Len=0"
"168","0.357008717","192.168.1.171","10.0.2.15","TCP","60","3000  >  57988 [ACK] Seq=260 Ack=74213 Win=65535 Len=0"
"169","0.357010390","192.168.1.171","10.0.2.15","TCP","60","3000  >  57988 [ACK] Seq=260 Ack=74944 Win=65535 Len=0"
"170","0.357137490","10.0.2.15","192.168.1.171","TCP","312","57998  >  3000 [PSH, ACK] Seq=1 Ack=1 Win=64240 Len=258 [TCP segment of a reassembled PDU]"
"171","0.357287967","10.0.2.15","192.168.1.171","TCP","7354","57998  >  3000 [ACK] Seq=259 Ack=1 Win=64240 Len=7300 [TCP segment of a reassembled PDU]"
"172","0.357376269","10.0.2.15","192.168.1.171","TCP","5894","57998  >  3000 [ACK] Seq=7559 Ack=1 Win=64240 Len=5840 [TCP segment of a reassembled PDU]"
"173","0.357442377","192.168.1.171","10.0.2.15","TCP","60","3000  >  57998 [ACK] Seq=1 Ack=259 Win=65535 Len=0"
"174","0.357516366","192.168.1.171","10.0.2.15","TCP","60","3000  >  57998 [ACK] Seq=1 Ack=1719 Win=65535 Len=0"
"175","0.357519864","192.168.1.171","10.0.2.15","TCP","60","3000  >  57998 [ACK] Seq=1 Ack=3179 Win=65535 Len=0"
"176","0.357521311","192.168.1.171","10.0.2.15","TCP","60","3000  >  57998 [ACK] Seq=1 Ack=4639 Win=65535 Len=0"
"177","0.357610388","192.168.1.171","10.0.2.15","TCP","60","3000  >  57998 [ACK] Seq=1 Ack=6099 Win=65535 Len=0"
"178","0.357614581","192.168.1.171","10.0.2.15","TCP","60","3000  >  57998 [ACK] Seq=1 Ack=7559 Win=65535 Len=0"
"179","0.357616185","192.168.1.171","10.0.2.15","TCP","60","3000  >  57998 [ACK] Seq=1 Ack=9019 Win=65535 Len=0"
"180","0.357617513","192.168.1.171","10.0.2.15","TCP","60","3000  >  57998 [ACK] Seq=1 Ack=10479 Win=65535 Len=0"
"181","0.357697813","10.0.2.15","192.168.1.171","TCP","2974","57998  >  3000 [ACK] Seq=13399 Ack=1 Win=64240 Len=2920 [TCP segment of a reassembled PDU]"
"182","0.357736489","192.168.1.171","10.0.2.15","TCP","60","3000  >  57998 [ACK] Seq=1 Ack=11939 Win=65535 Len=0"
"183","0.357740148","192.168.1.171","10.0.2.15","TCP","60","3000  >  57998 [ACK] Seq=1 Ack=13399 Win=65535 Len=0"
"184","0.357777182","10.0.2.15","192.168.1.171","TCP","2974","57998  >  3000 [ACK] Seq=16319 Ack=1 Win=64240 Len=2920 [TCP segment of a reassembled PDU]"
"185","0.357842882","192.168.1.171","10.0.2.15","TCP","60","3000  >  57998 [ACK] Seq=1 Ack=14859 Win=65535 Len=0"
"186","0.357847025","192.168.1.171","10.0.2.15","TCP","60","3000  >  57998 [ACK] Seq=1 Ack=16319 Win=65535 Len=0"
"187","0.357848390","192.168.1.171","10.0.2.15","TCP","60","3000  >  57998 [ACK] Seq=1 Ack=17779 Win=65535 Len=0"
"188","0.357887771","10.0.2.15","192.168.1.171","TCP","2974","57998  >  3000 [ACK] Seq=19239 Ack=1 Win=64240 Len=2920 [TCP segment of a reassembled PDU]"
"189","0.357956788","192.168.1.171","10.0.2.15","TCP","60","3000  >  57998 [ACK] Seq=1 Ack=19239 Win=65535 Len=0"
"190","0.357961559","192.168.1.171","10.0.2.15","TCP","60","3000  >  57998 [ACK] Seq=1 Ack=20699 Win=65535 Len=0"
"191","0.357997647","10.0.2.15","192.168.1.171","TCP","2974","57998  >  3000 [ACK] Seq=22159 Ack=1 Win=64240 Len=2920 [TCP segment of a reassembled PDU]"
"192","0.358061400","192.168.1.171","10.0.2.15","TCP","60","3000  >  57998 [ACK] Seq=1 Ack=22159 Win=65535 Len=0"
"193","0.358152622","10.0.2.15","192.168.1.171","TCP","8814","57998  >  3000 [ACK] Seq=25079 Ack=1 Win=64240 Len=8760 [TCP segment of a reassembled PDU]"
"194","0.358187726","192.168.1.171","10.0.2.15","TCP","60","3000  >  57998 [ACK] Seq=1 Ack=23619 Win=65535 Len=0"
"195","0.358191817","192.168.1.171","10.0.2.15","TCP","60","3000  >  57998 [ACK] Seq=1 Ack=25079 Win=65535 Len=0"
"196","0.358235843","10.0.2.15","192.168.1.171","TCP","5894","57998  >  3000 [ACK] Seq=33839 Ack=1 Win=64240 Len=5840 [TCP segment of a reassembled PDU]"
"197","0.358305345","192.168.1.171","10.0.2.15","TCP","60","3000  >  57998 [ACK] Seq=1 Ack=26539 Win=65535 Len=0"
"198","0.358308914","192.168.1.171","10.0.2.15","TCP","60","3000  >  57998 [ACK] Seq=1 Ack=27999 Win=65535 Len=0"
"199","0.358347328","10.0.2.15","192.168.1.171","TCP","2974","57998  >  3000 [ACK] Seq=39679 Ack=1 Win=64240 Len=2920 [TCP segment of a reassembled PDU]"
"200","0.358412719","192.168.1.171","10.0.2.15","TCP","60","3000  >  57998 [ACK] Seq=1 Ack=29459 Win=65535 Len=0"
"201","0.358416476","192.168.1.171","10.0.2.15","TCP","60","3000  >  57998 [ACK] Seq=1 Ack=30919 Win=65535 Len=0"
"202","0.358418250","192.168.1.171","10.0.2.15","TCP","60","3000  >  57998 [ACK] Seq=1 Ack=32379 Win=65535 Len=0"
"203","0.358419593","192.168.1.171","10.0.2.15","TCP","60","3000  >  57998 [ACK] Seq=1 Ack=33839 Win=65535 Len=0"
"204","0.358504366","10.0.2.15","192.168.1.171","TCP","2974","57998  >  3000 [PSH, ACK] Seq=42599 Ack=1 Win=64240 Len=2920 [TCP segment of a reassembled PDU]"
"205","0.358535736","192.168.1.171","10.0.2.15","TCP","60","3000  >  57998 [ACK] Seq=1 Ack=35299 Win=65535 Len=0"
"206","0.358539651","192.168.1.171","10.0.2.15","TCP","60","3000  >  57998 [ACK] Seq=1 Ack=36759 Win=65535 Len=0"
"207","0.358541173","192.168.1.171","10.0.2.15","TCP","60","3000  >  57998 [ACK] Seq=1 Ack=38219 Win=65535 Len=0"
"208","0.358542419","192.168.1.171","10.0.2.15","TCP","60","3000  >  57998 [ACK] Seq=1 Ack=39679 Win=65535 Len=0"
"209","0.358543660","192.168.1.171","10.0.2.15","TCP","60","3000  >  57998 [ACK] Seq=1 Ack=41139 Win=65535 Len=0"
"210","0.358627692","192.168.1.171","10.0.2.15","TCP","60","3000  >  57998 [ACK] Seq=1 Ack=42599 Win=65535 Len=0"
"211","0.358631658","192.168.1.171","10.0.2.15","TCP","60","3000  >  57998 [ACK] Seq=1 Ack=44059 Win=65535 Len=0"
"212","0.358633191","192.168.1.171","10.0.2.15","TCP","60","3000  >  57998 [ACK] Seq=1 Ack=45519 Win=65535 Len=0"
"213","0.358682477","10.0.2.15","192.168.1.171","TCP","11734","57998  >  3000 [ACK] Seq=45519 Ack=1 Win=64240 Len=11680 [TCP segment of a reassembled PDU]"
"214","0.358771943","10.0.2.15","192.168.1.171","TCP","8650","57998  >  3000 [PSH, ACK] Seq=57199 Ack=1 Win=64240 Len=8596 [TCP segment of a reassembled PDU]"
"215","0.358857509","192.168.1.171","10.0.2.15","TCP","60","3000  >  57998 [ACK] Seq=1 Ack=46979 Win=65535 Len=0"
"216","0.358861566","192.168.1.171","10.0.2.15","TCP","60","3000  >  57998 [ACK] Seq=1 Ack=48439 Win=65535 Len=0"
"217","0.358862988","192.168.1.171","10.0.2.15","TCP","60","3000  >  57998 [ACK] Seq=1 Ack=49899 Win=65535 Len=0"
"218","0.358955124","192.168.1.171","10.0.2.15","TCP","60","3000  >  57998 [ACK] Seq=1 Ack=51359 Win=65535 Len=0"
"219","0.359057330","192.168.1.171","10.0.2.15","TCP","60","3000  >  57998 [ACK] Seq=1 Ack=52819 Win=65535 Len=0"
"220","0.359063639","192.168.1.171","10.0.2.15","TCP","60","3000  >  57998 [ACK] Seq=1 Ack=54279 Win=65535 Len=0"
"221","0.359065655","192.168.1.171","10.0.2.15","TCP","60","3000  >  57998 [ACK] Seq=1 Ack=55739 Win=65535 Len=0"
"222","0.359067433","192.168.1.171","10.0.2.15","TCP","60","3000  >  57998 [ACK] Seq=1 Ack=57199 Win=65535 Len=0"
"223","0.359133141","192.168.1.171","10.0.2.15","TCP","60","3000  >  57998 [ACK] Seq=1 Ack=58659 Win=65535 Len=0"
"224","0.359138411","192.168.1.171","10.0.2.15","TCP","60","3000  >  57998 [ACK] Seq=1 Ack=60119 Win=65535 Len=0"
"225","0.359235582","192.168.1.171","10.0.2.15","TCP","60","3000  >  57998 [ACK] Seq=1 Ack=61579 Win=65535 Len=0"
"226","0.359240758","192.168.1.171","10.0.2.15","TCP","60","3000  >  57998 [ACK] Seq=1 Ack=63039 Win=65535 Len=0"
"227","0.359242937","192.168.1.171","10.0.2.15","TCP","60","3000  >  57998 [ACK] Seq=1 Ack=64499 Win=65535 Len=0"
"228","0.359371116","10.0.2.15","192.168.1.171","TCP","312","58000  >  3000 [PSH, ACK] Seq=1 Ack=1 Win=64240 Len=258 [TCP segment of a reassembled PDU]"
"229","0.359439922","192.168.1.171","10.0.2.15","TCP","60","3000  >  57998 [ACK] Seq=1 Ack=65795 Win=65535 Len=0"
"230","0.359543466","10.0.2.15","192.168.1.171","TCP","7354","58000  >  3000 [ACK] Seq=259 Ack=1 Win=64240 Len=7300 [TCP segment of a reassembled PDU]"
"231","0.359642923","10.0.2.15","192.168.1.171","TCP","5894","58000  >  3000 [ACK] Seq=7559 Ack=1 Win=64240 Len=5840 [TCP segment of a reassembled PDU]"
"232","0.359712004","192.168.1.171","10.0.2.15","TCP","60","3000  >  58000 [ACK] Seq=1 Ack=259 Win=65535 Len=0"
"233","0.359716402","192.168.1.171","10.0.2.15","TCP","60","3000  >  58000 [ACK] Seq=1 Ack=1719 Win=65535 Len=0"
"234","0.359762036","10.0.2.15","192.168.1.171","TCP","2974","58000  >  3000 [ACK] Seq=13399 Ack=1 Win=64240 Len=2920 [TCP segment of a reassembled PDU]"
"235","0.359826458","192.168.1.171","10.0.2.15","TCP","60","3000  >  58000 [ACK] Seq=1 Ack=3179 Win=65535 Len=0"
"236","0.359830484","192.168.1.171","10.0.2.15","TCP","60","3000  >  58000 [ACK] Seq=1 Ack=4639 Win=65535 Len=0"
"237","0.359831843","192.168.1.171","10.0.2.15","TCP","60","3000  >  58000 [ACK] Seq=1 Ack=6099 Win=65535 Len=0"
"238","0.359833101","192.168.1.171","10.0.2.15","TCP","60","3000  >  58000 [ACK] Seq=1 Ack=7559 Win=65535 Len=0"
"239","0.359876674","10.0.2.15","192.168.1.171","TCP","2974","58000  >  3000 [ACK] Seq=16319 Ack=1 Win=64240 Len=2920 [TCP segment of a reassembled PDU]"
"240","0.359945304","192.168.1.171","10.0.2.15","TCP","60","3000  >  58000 [ACK] Seq=1 Ack=9019 Win=65535 Len=0"
"241","0.359949629","192.168.1.171","10.0.2.15","TCP","60","3000  >  58000 [ACK] Seq=1 Ack=10479 Win=65535 Len=0"
"242","0.359951707","192.168.1.171","10.0.2.15","TCP","60","3000  >  58000 [ACK] Seq=1 Ack=11939 Win=65535 Len=0"
"243","0.359991321","10.0.2.15","192.168.1.171","TCP","2974","58000  >  3000 [ACK] Seq=19239 Ack=1 Win=64240 Len=2920 [TCP segment of a reassembled PDU]"
"244","0.360055026","192.168.1.171","10.0.2.15","TCP","60","3000  >  58000 [ACK] Seq=1 Ack=13399 Win=65535 Len=0"
"245","0.360058767","192.168.1.171","10.0.2.15","TCP","60","3000  >  58000 [ACK] Seq=1 Ack=14859 Win=65535 Len=0"
"246","0.360060518","192.168.1.171","10.0.2.15","TCP","60","3000  >  58000 [ACK] Seq=1 Ack=16319 Win=65535 Len=0"
"247","0.360062134","192.168.1.171","10.0.2.15","TCP","60","3000  >  58000 [ACK] Seq=1 Ack=17779 Win=65535 Len=0"
"248","0.360063467","192.168.1.171","10.0.2.15","TCP","60","3000  >  58000 [ACK] Seq=1 Ack=19239 Win=65535 Len=0"
"249","0.360102359","10.0.2.15","192.168.1.171","TCP","2974","58000  >  3000 [ACK] Seq=22159 Ack=1 Win=64240 Len=2920 [TCP segment of a reassembled PDU]"
"250","0.360166931","192.168.1.171","10.0.2.15","TCP","60","3000  >  58000 [ACK] Seq=1 Ack=20699 Win=65535 Len=0"
"251","0.360171192","192.168.1.171","10.0.2.15","TCP","60","3000  >  58000 [ACK] Seq=1 Ack=22159 Win=65535 Len=0"
"252","0.360215841","10.0.2.15","192.168.1.171","TCP","8814","58000  >  3000 [ACK] Seq=25079 Ack=1 Win=64240 Len=8760 [TCP segment of a reassembled PDU]"
"253","0.360284982","192.168.1.171","10.0.2.15","TCP","60","3000  >  58000 [ACK] Seq=1 Ack=23619 Win=65535 Len=0"
"254","0.360288853","192.168.1.171","10.0.2.15","TCP","60","3000  >  58000 [ACK] Seq=1 Ack=25079 Win=65535 Len=0"
"255","0.360290140","192.168.1.171","10.0.2.15","TCP","60","3000  >  58000 [ACK] Seq=1 Ack=26539 Win=65535 Len=0"
"256","0.360374272","192.168.1.171","10.0.2.15","TCP","60","3000  >  58000 [ACK] Seq=1 Ack=27999 Win=65535 Len=0"
"257","0.360378187","192.168.1.171","10.0.2.15","TCP","60","3000  >  58000 [ACK] Seq=1 Ack=29459 Win=65535 Len=0"
"258","0.360419096","10.0.2.15","192.168.1.171","TCP","8814","58000  >  3000 [ACK] Seq=33839 Ack=1 Win=64240 Len=8760 [TCP segment of a reassembled PDU]"
"259","0.360534747","192.168.1.171","10.0.2.15","TCP","60","3000  >  58000 [ACK] Seq=1 Ack=30919 Win=65535 Len=0"
"260","0.360538625","192.168.1.171","10.0.2.15","TCP","60","3000  >  58000 [ACK] Seq=1 Ack=32379 Win=65535 Len=0"
"261","0.360540674","192.168.1.171","10.0.2.15","TCP","60","3000  >  58000 [ACK] Seq=1 Ack=33839 Win=65535 Len=0"
"262","0.360541998","192.168.1.171","10.0.2.15","TCP","60","3000  >  58000 [ACK] Seq=1 Ack=35299 Win=65535 Len=0"
"263","0.360543533","192.168.1.171","10.0.2.15","TCP","60","3000  >  58000 [ACK] Seq=1 Ack=36759 Win=65535 Len=0"
"264","0.360593732","10.0.2.15","192.168.1.171","TCP","1514","58000  >  3000 [ACK] Seq=42599 Ack=1 Win=64240 Len=1460 [TCP segment of a reassembled PDU]"
"265","0.360671139","192.168.1.171","10.0.2.15","TCP","60","3000  >  58000 [ACK] Seq=1 Ack=38219 Win=65535 Len=0"
"266","0.360676084","192.168.1.171","10.0.2.15","TCP","60","3000  >  58000 [ACK] Seq=1 Ack=39679 Win=65535 Len=0"
"267","0.360677790","192.168.1.171","10.0.2.15","TCP","60","3000  >  58000 [ACK] Seq=1 Ack=41139 Win=65535 Len=0"
"268","0.360679092","192.168.1.171","10.0.2.15","TCP","60","3000  >  58000 [ACK] Seq=1 Ack=42599 Win=65535 Len=0"
"269","0.360718470","10.0.2.15","192.168.1.171","TCP","1514","58000  >  3000 [PSH, ACK] Seq=44059 Ack=1 Win=64240 Len=1460 [TCP segment of a reassembled PDU]"
"270","0.360783418","192.168.1.171","10.0.2.15","TCP","60","3000  >  58000 [ACK] Seq=1 Ack=44059 Win=65535 Len=0"
"271","0.360867787","192.168.1.171","10.0.2.15","TCP","60","3000  >  58000 [ACK] Seq=1 Ack=45519 Win=65535 Len=0"
"272","0.360922319","10.0.2.15","192.168.1.171","TCP","11734","58000  >  3000 [ACK] Seq=45519 Ack=1 Win=64240 Len=11680 [TCP segment of a reassembled PDU]"
"273","0.361017416","10.0.2.15","192.168.1.171","TCP","8650","58000  >  3000 [PSH, ACK] Seq=57199 Ack=1 Win=64240 Len=8596 [TCP segment of a reassembled PDU]"
"274","0.361094051","192.168.1.171","10.0.2.15","TCP","60","3000  >  58000 [ACK] Seq=1 Ack=46979 Win=65535 Len=0"
"275","0.361098028","192.168.1.171","10.0.2.15","TCP","60","3000  >  58000 [ACK] Seq=1 Ack=48439 Win=65535 Len=0"
"276","0.361191708","192.168.1.171","10.0.2.15","TCP","60","3000  >  58000 [ACK] Seq=1 Ack=49899 Win=65535 Len=0"
"277","0.361196447","192.168.1.171","10.0.2.15","TCP","60","3000  >  58000 [ACK] Seq=1 Ack=51359 Win=65535 Len=0"
"278","0.361198035","192.168.1.171","10.0.2.15","TCP","60","3000  >  58000 [ACK] Seq=1 Ack=52819 Win=65535 Len=0"
"279","0.361301542","192.168.1.171","10.0.2.15","TCP","60","3000  >  58000 [ACK] Seq=1 Ack=54279 Win=65535 Len=0"
"280","0.361305091","192.168.1.171","10.0.2.15","TCP","60","3000  >  58000 [ACK] Seq=1 Ack=55739 Win=65535 Len=0"
"281","0.361306062","192.168.1.171","10.0.2.15","TCP","60","3000  >  58000 [ACK] Seq=1 Ack=57199 Win=65535 Len=0"
"282","0.361476887","192.168.1.171","10.0.2.15","TCP","60","3000  >  58000 [ACK] Seq=1 Ack=58659 Win=65535 Len=0"
"283","0.362186034","192.168.1.171","10.0.2.15","TCP","60","3000  >  58000 [ACK] Seq=1 Ack=60119 Win=65535 Len=0"
"284","0.362196210","192.168.1.171","10.0.2.15","TCP","60","3000  >  58000 [ACK] Seq=1 Ack=61579 Win=65535 Len=0"
"285","0.362197666","192.168.1.171","10.0.2.15","TCP","60","3000  >  58000 [ACK] Seq=1 Ack=63039 Win=65535 Len=0"
"286","0.362198794","192.168.1.171","10.0.2.15","TCP","60","3000  >  58000 [ACK] Seq=1 Ack=64499 Win=65535 Len=0"
"287","0.362200182","192.168.1.171","10.0.2.15","TCP","60","3000  >  58000 [ACK] Seq=1 Ack=65795 Win=65535 Len=0"
"288","0.362856250","10.0.2.15","192.168.1.171","TCP","312","58002  >  3000 [PSH, ACK] Seq=1 Ack=1 Win=64240 Len=258 [TCP segment of a reassembled PDU]"
"289","0.363118816","192.168.1.170","10.0.2.15","TCP","2894","3000  >  40722 [ACK] Seq=1 Ack=140 Win=65535 Len=2840 [TCP segment of a reassembled PDU]"
"290","0.363130882","10.0.2.15","192.168.1.170","TCP","54","40722  >  3000 [ACK] Seq=140 Ack=2841 Win=62480 Len=0"
"291","0.363326127","192.168.1.171","10.0.2.15","TCP","60","3000  >  58002 [ACK] Seq=1 Ack=259 Win=65535 Len=0"
"292","0.363361933","192.168.1.170","10.0.2.15","TCP","4314","3000  >  40722 [ACK] Seq=2841 Ack=140 Win=65535 Len=4260 [TCP segment of a reassembled PDU]"
"293","0.363371983","10.0.2.15","192.168.1.170","TCP","54","40722  >  3000 [ACK] Seq=140 Ack=7101 Win=59640 Len=0"
"294","0.363523336","192.168.1.170","10.0.2.15","TCP","5734","3000  >  40722 [ACK] Seq=7101 Ack=140 Win=65535 Len=5680 [TCP segment of a reassembled PDU]"
"295","0.363532449","10.0.2.15","192.168.1.170","TCP","54","40722  >  3000 [ACK] Seq=140 Ack=12781 Win=55380 Len=0"
"296","0.363670882","192.168.1.170","10.0.2.15","HTTP","4726","HTTP/1.1 200 OK  (application/json)"
"297","0.363679962","10.0.2.15","192.168.1.170","TCP","54","40722  >  3000 [ACK] Seq=140 Ack=17453 Win=52540 Len=0"
"298","0.364717695","10.0.2.15","192.168.1.171","TCP","7354","58002  >  3000 [ACK] Seq=259 Ack=1 Win=64240 Len=7300 [TCP segment of a reassembled PDU]"
"299","0.364780208","10.0.2.15","192.168.1.171","TCP","7354","58002  >  3000 [ACK] Seq=7559 Ack=1 Win=64240 Len=7300 [TCP segment of a reassembled PDU]"
"300","0.364969560","10.0.2.15","192.168.1.171","TCP","312","58004  >  3000 [PSH, ACK] Seq=1 Ack=1 Win=64240 Len=258 [TCP segment of a reassembled PDU]"
"301","0.365017006","192.168.1.171","10.0.2.15","TCP","60","3000  >  58002 [ACK] Seq=1 Ack=1719 Win=65535 Len=0"
"302","0.365047865","10.0.2.15","192.168.1.171","TCP","2974","58002  >  3000 [ACK] Seq=14859 Ack=1 Win=64240 Len=2920 [TCP segment of a reassembled PDU]"
"303","0.365073979","192.168.1.171","10.0.2.15","TCP","60","3000  >  58002 [ACK] Seq=1 Ack=3179 Win=65535 Len=0"
"304","0.365081620","10.0.2.15","192.168.1.171","TCP","2974","58002  >  3000 [ACK] Seq=17779 Ack=1 Win=64240 Len=2920 [TCP segment of a reassembled PDU]"
"305","0.365092858","192.168.1.171","10.0.2.15","TCP","60","3000  >  58002 [ACK] Seq=1 Ack=4639 Win=65535 Len=0"
"306","0.365096974","10.0.2.15","192.168.1.171","TCP","2974","58002  >  3000 [ACK] Seq=20699 Ack=1 Win=64240 Len=2920 [TCP segment of a reassembled PDU]"
"307","0.365120723","192.168.1.171","10.0.2.15","TCP","60","3000  >  58002 [ACK] Seq=1 Ack=6099 Win=65535 Len=0"
"308","0.365125748","192.168.1.171","10.0.2.15","TCP","60","3000  >  58002 [ACK] Seq=1 Ack=7559 Win=65535 Len=0"
"309","0.365129220","192.168.1.171","10.0.2.15","TCP","60","3000  >  58002 [ACK] Seq=1 Ack=9019 Win=65535 Len=0"
"310","0.365133140","10.0.2.15","192.168.1.171","TCP","8814","58002  >  3000 [ACK] Seq=23619 Ack=1 Win=64240 Len=8760 [TCP segment of a reassembled PDU]"
"311","0.365157780","192.168.1.171","10.0.2.15","TCP","60","3000  >  58002 [ACK] Seq=1 Ack=10479 Win=65535 Len=0"
"312","0.365239544","192.168.1.171","10.0.2.15","TCP","60","3000  >  58002 [ACK] Seq=1 Ack=11939 Win=65535 Len=0"
"313","0.365245792","192.168.1.171","10.0.2.15","TCP","60","3000  >  58002 [ACK] Seq=1 Ack=13399 Win=65535 Len=0"
"314","0.365485201","192.168.1.171","10.0.2.15","TCP","60","3000  >  58002 [ACK] Seq=1 Ack=14859 Win=65535 Len=0"
"315","0.365495320","10.0.2.15","192.168.1.171","TCP","11734","58002  >  3000 [ACK] Seq=32379 Ack=1 Win=64240 Len=11680 [TCP segment of a reassembled PDU]"
"316","0.365540217","192.168.1.171","10.0.2.15","TCP","60","3000  >  58004 [ACK] Seq=1 Ack=259 Win=65535 Len=0"
"317","0.365546330","192.168.1.171","10.0.2.15","TCP","60","3000  >  58002 [ACK] Seq=1 Ack=16319 Win=65535 Len=0"
"318","0.365551186","10.0.2.15","192.168.1.171","TCP","2974","58002  >  3000 [PSH, ACK] Seq=44059 Ack=1 Win=64240 Len=2920 [TCP segment of a reassembled PDU]"
"319","0.365575913","192.168.1.171","10.0.2.15","TCP","60","3000  >  58002 [ACK] Seq=1 Ack=17779 Win=65535 Len=0"
"320","0.365582149","192.168.1.171","10.0.2.15","TCP","60","3000  >  58002 [ACK] Seq=1 Ack=19239 Win=65535 Len=0"
"321","0.365584538","192.168.1.171","10.0.2.15","TCP","60","3000  >  58002 [ACK] Seq=1 Ack=20699 Win=65535 Len=0"
"322","0.365587081","192.168.1.171","10.0.2.15","TCP","60","3000  >  58002 [ACK] Seq=1 Ack=22159 Win=65535 Len=0"
"323","0.365589293","192.168.1.171","10.0.2.15","TCP","60","3000  >  58002 [ACK] Seq=1 Ack=23619 Win=65535 Len=0"
